ID,Title,Location,Salary,Summary
3d8e270a47a88295,DevOps Engineer,하이퍼커넥트 서울,,"유지하면서 production에 적용합니다. 지원자격 1년 이상의 Linux 계열 서버 관련 실무 경험 Python 등의 스크립트 언어를 이용한 코딩 능력 OS, 네트워크를 중심으로 하는 CS 전반에 걸친 기본적인 이해..."
37da5b148b2d3ef4,Senior Data Scientist - AWS Professional...,Amazon Web Services Korea LLC 서울,,"track record of building ML or DL models · Experience using Python... R · Able to write production level code, which..."
60c38beac39270b1,Full Stack Developer (Internal Products),토스 서울 강남구,,"수 있는 분 우대 사항 Python/Django 기반의 서비스 개발 경험이 있는 분 React 개발 경험이 있는 분 RDB 쿼리 최적화 경험이 있는 분 토스를 구성하는 기술 Python, Django MTV, Django..."
f10477b81840d778,데이터 분석가 / Business Analyst,Bagelcode 서울,,중독자 [우대 사항] - Tableau 등 시각화 툴을 활용한 대시보드 설계 및 운영 경험 - SQL / Python / R 등 데이터 분석 업무를 수행할 수 있는 하나 이상의 개발 언어 유경험자 - 비즈니스 레벨 이상의...
8b29e16a2f9665f2,"Principal, Strategic Planning",Coupang 3.1 서울,,"e-commerce and other internet-based industries; retail SQL, Python experience is a plus Experience with Tableau also a plus..."
5164238b12d010da,인공지능(AI) SW개발 담당 0명 자동화 산업장비 제조업,자동화 산업장비 제조업 대한민국,,"운용 3) C#, JavaScript, Python, UI 개발 4) Big Data 관련 개발 [우대사항] 1) 인공지능 기술 경험자 우대 2) C#, JavaScript, Python, UI 개발 경험자 3) Big..."
6718bba08ef6e20b,모바일 앱 보안 솔루션 개발부문,스틸리언 서울 용산구,,"Android/iOS 모바일 앱 보안 제품입니다. - 앱수트는 C, Python 등을 통해 주로 개발합니다. - 앱수트 제품군에는 위변조 방지, 난독... 2) - Objective C, Python, C언어, Swift 개발..."
a8f2de7c03aa263c,4차산업선도인력 빅데이터-IoT 국비지원 교육생,비트컴퓨터 서울 강남구,,"습득 및 프로젝트 수행 후 관련 분야로 취업을 원하는 자 Java, Python 등 기본 프로그래밍 유 경험자 - 선발 우대사항 IT관련 전공학과... 게임>빅데이터·AI(인공지능)> Python|인터넷·IT·통신·모바일·게임..."
f2e8324d211ea289,데이터프로덕트 서버 개발자 (2년 이상),우아한 형제들 서울 송파구,,운영 경험을 보유하신 분 [우대사항] - Spring batch 등을 활용한 배치 개발경험을 보유하신 분 - Python(Flask/Django)을 활용한 서비스 개발경험을 보유하신 분 - 머신러닝에 대한 이해를 갖추신 분...
f59ae6a493eec795,"[R0001563] Principal, Back-end Engineer...",Coupang 3.1 서울,,"analysis) Computer Science Fundamentals 이수 Java, C++, C, Python, Scala 등 현대 프로그래밍 언어 중 최소 한 가지 이상을 능숙하게 활용할 수 있음 (본사에서는 주로..."
525fdab567ce9db2,DevOps 개발자 (백엔드),토이스미스 서울 강남구,,"및 Service Mesh 에 대한 이해 l 서버 관리 자동화 경험 개발스택 l 개발 언어: Golang, python, node l 플랫폼: AWS, Docker Swarm l 라우팅: Route53, Traefik l..."
054fa6ab927802c9,O2O Platform Frontend Web개발(경력),에이치에너지 서울 강남구,,접수양식: 인크루트 이력서 기타 유의사항 입사지원서 및 제출서류에 허위사실이 있을 경우 채용이 취소될 수 있습니다. 인터넷·IT·통신·모바일·게임>웹프로그래머>프론트엔드|인터넷·IT·통신·모바일·게임>웹프로그래머> Python
081ba90fcfa975e3,4G LTE/5G NR Software Engineer,Success Korea 서울 신대방동,,Any scripting language experience e.g. python or perl... plus. - 2+ years... experience e.g. python or perl... plus...
62188527e0229352,DGIST-ETH 마이크로로봇연구센터 계약직 직원(Post-doc) 공개...,대구경북과학기술원 대구 현풍면,,"COMSOL, ANSYS 등) 사용 경험자 우대 MATLAB, Python 등을 사용한 기본적인 프로그래밍 경험자 우대 MEMS/BioMEMS... 경험자 우대 MATLAB, Python 등을 사용한 기본적인 프로그래밍..."
2625bdacef9c5d08,"Specialist Solutions Architect III, AI/M...",Amazon Web Services Korea LLC 서울,,"Spark and Hadoop. · Experienced in data processing with Python, R & SQL. · Experience with AWS services related to AI/ML..."
80d3108dade97b0f,Back-end Developer,"Miso, inc 서울",,"이런 분과 함께하고 싶습니다] 백엔드 개발 경력 3년 이상 Ruby, Python, Go, Node.js 중 하나 이상의 언어에 능숙하신 분 새로운... Data Science: Go, Python Collaboration..."
5f3b7800e776da58,Senior Business Analysis (Strategic Plan...,Coupang 3.1 서울,,"e-commerce and other internet-based industries; retail -SQL, Python experience is a plus -Experience with Tableau also a plus..."
b3dc36f873b9e4e3,2020 Market Data Analyst - Seoul (Korean Speaker),Bloomberg 서울,,"languages (e.g. Python, R, JavaScript... programming/scripting languages (e.g. Python, R, JavaScript, Java) as well as SQL..."
c1037225077ca4da,데이터 분석가 (Business Intelligence Analyst),코스닥 상장 중견 게임기업 서울 강남구,"연봉 40,000,000원 - 70,000,000원","데이터 분석 결과를 쉽게 이해할 수 있도록 간결하고 명확한 의사전달 능력 [우대조건] * R, Python, Spark 등의 언어에 대한 이해도 * 모바일 앱SDK 연동 지원 업무 경험(Facebook, Admob..."
d11342cfe074df78,Frontend Developer (Javascript/React),Bepro Company 서울,"연봉 30,000,000원 - 80,000,000원",참고 - React JS (Web) / Kotlin (Android) / Swift (iOS) - Python + Django - AWS lambda + API gateway - MySQL - Google Cloud...
674370fd38bce0dd,지스트 블록체인경제센터(강남소재) 계약직(연구원),광주과학기술원 광주 북구,,블록체인 경제 블록체인 하드포크 1) 4년대 대학 이상 졸업자 2) SW프로그래밍 제작 경험자 3) Python/C/Java/Go 프로그래밍 가능자 우대사항 ① 국가보훈대상자(취업보호대상자) 및 장애인은 관련 법령...
80f1a9fe40a6c290,[Search] Papago Software Engineer 경력사원,네이버 서울,,"개발 / 운영 [ 자격요건 및 우대사항 ] · Spring 기반 백엔드 서버 개발 / 운영 경험 필수 · Python 개발 / 운영 경험 우대 [ 채용하고 싶은 사람 ] · 프로그램 설계 , 디버깅 , 자료구조 및 알고..."
1d98c46b4900b7e6,Pipeline TD,Mofac 서울 서초구,,"지식과 경험 – Cross Platform OS 경험자(Windows, Linux, Mac OS) – Python, MEL, PyQt, PySide, C++ 등 저작도구 관련된 프로그래밍 가능자 – 컴퓨터 그래픽스에 대한..."
e8d1c3f88e0b200b,Data Scientist,해외송금 전문업체 서울 강남구,,"유지보수 - 데이터 시각화 [ 자격요건 ] - 경력 2~4년차 - SQL 사용이 능숙하신 분(필수) - R, Python 등을 이용한 분석 경험 [ 우대사항 ] - 빅데이터 및 금융데이터 분석 및 예측 - 통계학 전공자..."
025677c2637bef23,데이터플랫폼 개발자 모집,넷마블 서울 구로구,,API 서버 개발/운영 - 스케쥴에 의한 Batch 작업 스크립트 개발/운영 자격요건 - Java / Python 중 1개이상 프로그래밍 경력 3년 이상 - Unix 운영체제 기초 지식 및 Shell 개발 경험 3년 이상...
f2e8324d211ea289,데이터프로덕트 서버 개발자 (2년 이상),우아한 형제들 서울 송파구,,운영 경험을 보유하신 분 [우대사항] - Spring batch 등을 활용한 배치 개발경험을 보유하신 분 - Python(Flask/Django)을 활용한 서비스 개발경험을 보유하신 분 - 머신러닝에 대한 이해를 갖추신 분...
054fa6ab927802c9,O2O Platform Frontend Web개발(경력),에이치에너지 서울 강남구,,접수양식: 인크루트 이력서 기타 유의사항 입사지원서 및 제출서류에 허위사실이 있을 경우 채용이 취소될 수 있습니다. 인터넷·IT·통신·모바일·게임>웹프로그래머>프론트엔드|인터넷·IT·통신·모바일·게임>웹프로그래머> Python
45a8d1ec64004328,"[해외취업] IT 프로그래머,web개발 엔지니어,Java프로그래머,인프라...",SEAGILE 대한민국,"연봉 35,100,000원 - 70,000,000원","외 아래 언어, 스킬 보유자 *개발환경 업무 범위 1.웹개발 엔지니어 -언어: Java、Spring,PHP、 Python, Ruby、java script, JQuery등 -DB: MySQL, Oracle -OS: Linux..."
b346d97741fd59f0,TD (Pipeline Developer),Calm Island 서울,,"Shotgun, Slack과의 연동 툴 개발 자격 요건 애니메이션 제작 파이프라인 개발 경력 3년 이상 Python 프로그래밍 능력 Maya, Nuke, Shotgun 등의 애니메이션 제작 소프트웨어에 대한 이해 Qt..."
16dff836029458af,"모바일 앱 서버 개발(Java, Python)",휴먼디지털 서울,,"Python) 자격조건 - 정보시스템 설계 및 데이터 마이닝용 시스템 설계. - 모바일 앱 서비스용 서버 API 설계 및 개발. - 주소록 동기화, Confirmed Push 경험 하신 분 우대. - 자바, Python..."
e541375257c12d9b,Sr. Back-end Engineer (SCM Systems),Coupang 3.1 서울,,"수립 지원 자격 요건 컴퓨터 공학 또는 엔지니어링 관련 분야 학사학위 취득자 Java, C/C++, Python 활용 소프트웨어 개발 경력 3년 이상인 분 우대 사항 컴퓨터공학 석사 또는 박사학위 eCommerce..."
84348b9371558933,[Autonomous Driving] Software Tool Engin...,네이버 서울,,"팀원들과 협업 • 필요역량 ㅇ Python/C/C++ 언어 개발 용이 ㅇ... 다양한 전문 지식을 가진 팀원들과 협업 • 필요역량 ㅇ C/C++, Python 언어 개발 용이 ㅇ Annotation Drawing Tool 또는..."
744362d38e397b9b,[데이터분석] 웹 프론트 개발자,카카오엔터프라이즈 성남 분당구,,"구성을 위한 웹 프론트와 서버 기술의 이해 - React, Redux, HTML/CSS 에 대한 이해 - Python, Javascript 등의 프로그래밍 언어 사용 능력 [우대사항] - 서버 프로그래밍 개발 경험 ※ 오프라..."
a7c68eba65a950aa,지스트 블록체인경제센터 계약직연구원,광주과학기술원 광주 북구,,구직 1명 블록체인 개발 블록체인 경제 블록체인 하드포크 1) SW프로그래밍 제작 경험자 2) Python/C/Java/Go 프로그래밍 가능자 우대사항 ① 국가보훈대상자(취업보호대상자) 및 장애인은 관련 법령...
84917d467fb78934,2015년도 하반기 국립기상과학원 연구원(기간제근로자) (마감: 2015...,기상청 대한민국,,"ESGF 노드 운영 학사 이상 대기과학 또는 전산관련 학과 우대 유닉스, 리눅스, C, Java, python 등 유경험자 우대 국가공무원법 제33조 각 호의 결격사유가 없는 자(남자는 병역 필한 자) (최종합격..."
754348a9c3f08d66,Full Stack Developer,"Miso, inc 서울",,"이런 분과 함께하고 싶습니다] 개발 경력 3년 이상 Ruby, Python, Go, Node JS 중 하나 이상의 언어에 능숙하신 분 Ruby... Data Science: Go, Python Collaboration..."
449e0f73f32c6c7a,Cloud 서비스 (Infra as a Service) 개발자 (경력),카카오 4.2 성남 판교역,,"관련된 경험이 있으신 분 네트워크 가상화 및 데이터센터 네트워크 설계에 대한 경험이 있으신 분 Go, Python, JS(Angular/React) 등을 이용한 웹 애플리케이션 개발에 능숙하신 분 Ansible, Chef..."
9fa9d498506f86aa,기술영업(신입/경력),에이치알 코리아 대한민국,,"모집부문 기술영업(신입/경력) 업무내용 - 담당업무 : 기술영업 -> 국내 기술영업 지원자격 - 자격요건 영어 구사 가능자( 토익 750점 이상 또는 준하는 역량) - 우대사항 - 프로그래밍 언어 사용가능자(C, VB, Python)"
a2df135935d0125f,2018년도 국가기상위성센터 공무직근로자(연구원) (전문연구요원 포함),기상청 대한민국,,"개발 유경험자 ㅇ 프로그램 개발이 가능한 자(Fortran, C, Python, shell 등) 채용분야 채용 예정 직급 선발예정 인원... 가능한 자(Fortran, C, Python, shell 등) 2. 근무..."
2d1e42c180f4f791,[기술기획] 클라우드 플랫폼 개발자,한국카카오은행 성남 분당구,,"수 있는 분 · Golang, Python, Javascript 중 하나... 게임>응용프로그래머>클라우드|인터넷·IT·통신·모바일·게임>응용프로그래머> Python|인터넷·IT·통신·모바일·게임>응용프로그래머>자바스크립트|인터넷..."
2b9372dd785c38ea,"안드로이드/IOS 앱/웹개발자, 앱/웹 디자이너 신입/경력 정규직",오퍼튜니티 제주 제주시,"연봉 21,550,000원 - 25,000,000원",수 있습니다. 인터넷·IT·통신·모바일·게임>웹프로그래머>JAVA|인터넷·IT·통신·모바일·게임>웹프로그래머> Python|인터넷·IT·통신·모바일·게임>웹프로그래머>HTML·DHTML·mHTML|인터넷·IT·통신·모바일·게임...
f3b7d5dec9ee579f,[경력직 ] AI 시스템 풀스택 웹 개발자,마인즈랩 성남 분당구,,"시스템프로그래머시스템프로그래머 인공지능(AI).빅데이터인공지능(AI), 빅데이터, 머신러닝, DataAnalysis, Python 산업별(업종) SI.SM.ERP.CRM BigData, DataWarehouse"
24685d4466817f9f,[기술플랫폼실] BI 시스템 운영 및 개발 담당자 영입,카카오페이 성남 분당구,,"소스 기반의 시각화 도구(Zeppelin, Superset 등) 활용 경험이 있으신 분 - Java 또는 Python, Spark 개발 경험이 있으신 분 - 금융권 정보계 구축 및 운영 업무 경험이 있으신 분 - 클라우드..."
794e209e405f4fc0,지스트 블록체인경제센터(강남소재) 계약직연구원,광주과학기술원 광주 북구,,구직 명 블록체인 개발 블록체인 경제 블록체인 하드포크 1) SW프로그래밍 제작 경험자 2) Python/C/Java/Go 프로그래밍 가능자 우대사항 ① 국가보훈대상자(취업보호대상자) 및 장애인은 관련 법령...
cb7d24298c78f23f,[주식회사 옥퀘스트]인공지능 기반 뷰티&헬스케어 토털 서비스 전문 회사와...,옥퀘스트 서울 목동,,원 이하 상여금 별도 : 0% 면접 후 결정 가능 경력조건 신입 학력 고졸 ~ 석사 키워드 [인공지능 ] [ python ] [프로그래머 ] [웹개발 ] [C++ ] 우대사항 우대사항 외국어능력 - 전공 - 자격면허 - 병역특...
c62d380a1585df66,데이터 엔지니어 (3년 이상),우아한 형제들 서울 송파구,,Hadoop/Spark 기반의 빅데이터 인프라 구축 및 ETL 개발 경험(3년 이상) - Scala/Java/ Python 중 1개 이상의 언어 숙련자 - SQL 숙련자(MySQL/SparkSQL) - 1개 이상의 데이터 엔지...
2459b164bb22d0f4,DGIST 미래자동차융합연구센터 계약직 연구원 및 박사후연수연구원 공개...,대구경북과학기술원 대구 현풍면,,"사항 - S/W개발능력, C,C++, Python,Matlab 등 능숙자... Software 개발 우대 사항 - S/W개발능력, C,C++, Python, Linux환경 능숙자 - 자율주행 및 ADAS관련 프로젝트 참여경..."
62188527e0229352,DGIST-ETH 마이크로로봇연구센터 계약직 직원(Post-doc) 공개...,대구경북과학기술원 대구 현풍면,,"COMSOL, ANSYS 등) 사용 경험자 우대 MATLAB, Python 등을 사용한 기본적인 프로그래밍 경험자 우대 MEMS/BioMEMS... 경험자 우대 MATLAB, Python 등을 사용한 기본적인 프로그래밍..."
576ead69fc50c3e5,"Principal, Supply Chain Management(Inven...",Coupang 3.1 서울,,"세스/시스템 개선 리드 자격 요건: 물류/SCM, 엔지니어링 분야 학사 이상 데이터 분석역량(SQL, Python, R 등) 8년 이상 SCM/물류 관련 분야 경력 프로세스 개선/생산성 개선관련 프로젝트 리드경험 및 개선..."
f10477b81840d778,데이터 분석가 / Business Analyst,Bagelcode 서울,,중독자 [우대 사항] - Tableau 등 시각화 툴을 활용한 대시보드 설계 및 운영 경험 - SQL / Python / R 등 데이터 분석 업무를 수행할 수 있는 하나 이상의 개발 언어 유경험자 - 비즈니스 레벨 이상의...
2cca42ee0951d4be,"Principal, Business Analysis (Coupang Ea...",Coupang 3.1 서울,,"SQL, Excel, Python, and R/SAS or any... 경영학 학사 혹은 해당 분야에서 그에 준하는 경험 SQL, Excel, Python, R/SAS 등 통계 분석용 소프트웨어 활용 경험 Hadoop..."
fd2b74a92ae8b82e,생물정보분석 (Bioinformatics) 연구원,핼액을 기반으로 암의 조기진단에 도전하는 혁신적인 헬스케어 기업 서울 금천구,,"무관 ￭ 전공 : Genomics, bioinformatics 관련 생물정보학 경험자 우대 ￭ 필수 : Python, Perl, R 등에 대한 이해 및 사용 가능자 [우대사항] ￭ NGS 데이터 분석 경험자 ￭ 동종업계..."
315c65b8337d3e7a,React Native Developer,"Miso, inc 서울",,"Redux 등의 개발 경험을 보유하신 분 Golang, Node.js, Python, or Ruby 중 프로그래밍 언어 사용 가능하신 분 새로운 기술... Data Science: Go, Python Collaboration..."
dd34d9838bc38782,Android 앱개발자 (경력3년이상),이퓨인터내셔널 서울 강남구,"연봉 30,000,000원 - 35,000,000원",앱스토어 출시 유경험자 Android의 경우 Kotlin 개발 경험자 Python 개발경험자 아이폰 (IOS) 개발역량 보유자 1 명 주식회사 이퓨인... 통신·모바일·게임>응용프로그래머> Python|인터넷·IT·통신·모바일·게임...
78c00c14251300f6,"루이 웹/앱 프로그래머 정규직 연구원 및 해외마케팅 담당자, 판교 소재...",루이테크놀로지 성남 수정구,,"력서 전형절차 및 제출서류 전형절차 직무/산업 직무별(직종) 마케팅.브랜드해외마케팅 웹프로그래머웹프로그래머, Python 응용프로그래머전산전공, Application HTML코딩.퍼블리셔자바스크립트 인공지능(AI).빅데이터사..."
720c87b5a84f3d11,저축은행 디지털금융본부 Data Science 팀 CSS운영 경력자,국내자본 저축은행 서울 구로구,,"향구성 [자격요건] - 4년제 정규 대졸 이상 (통계, 수학, 산업공학 전공자 우대) - 통계프로그램(R, Python) 및 엑셀 활용가능자 - CSS운영 관리 경험자 경력 3년 이상 [전형절차] 서류, 면접 1회 [제출서류..."
2962f736a95cb7e2,웹 서비스 백엔드(Back-end) 시니어 개발자,스탠드포인트 서울 금천구,,이상 ) 학력사항: 대학교(4년)졸업 이상 PHP / JAVA / Python 언어 중 한가지 이상의 언어를 능숙히 사용하시는 분 AWS(Amazon... Laravel(PHP7+) / Python / Linux / MySQL...
d498993697237b33,AI(인공지능) 개발자,휴먼디지털 서울,,를 활용한 Machine Learning(Deep Learning) 개발 경험자 우대 3. C/C++/C#/ Python 등 프로그래밍 경험자 우대 4. 분산시스템에 대한 이해가 있는 분 우대 근무지 서울 연봉 회사내규에따름...
c495ae06620d2544,Junior and/or Senior S/W Engineers for C...,Success Korea 서울,,5 years of work experience in C and Python programming ?Minimum of 3 years of work... experience in C and Python programming...
7a08f5e589b10a00,"Senior, Software Engineer (Search Qualit...",Coupang 3.1 서울,,"경험 Java, Scala, Python 등의 객체 지향 언어에서 3년... Object Oriented language, Java, Scala, Python Data processing... Hadoop cluster..."
ee7e4f2e5d69f84c,DRE - Build Engineer,Success Korea 서울,,OO programming language · Experience with Python or related scripting language... Experience with Python or related...
ed3686b9c2eea9ad,"Principal, Data Engineer (Pricing Tech)",Coupang 3.1 서울,,"링하고 알림을 주는 시스템을 구축한다. 자격 요건: 컴퓨터 공학 혹은 관련 전공 수료자 Java, Python, Unix shell, html 프로그래밍 가능자 10년 이상 웹서비스 및 백엔드 개발을 하신 분 – 데이..."
882ce3f45214f1b1,Junior and/or Senior Engineers for MySQL...,Success Korea 서울,,5 years of work experience in C and Python programming ?Required Minimum of 5 years... experience in C and Python programming...
2485e93043545d8a,인간중심 지능형 시스템 연구실 위촉연구원,광주과학기술원 광주 북구,,"및 인간 대상 연구 수행) 공학 학사학위 이상 C#기반 SW개발 가능자 우대사항 ① 이외 개발언어 ( Python, C++, JAVA, MFC, QT 등) 기반 SW(앱/웹 포함) 개발 가능자 ② 인간대상연구 경험자..."
f5db97b4d95cbc04,VP of Engineering,"Miso, inc 서울",,"분 제품을 전체적으로 리드할 수 있는 분 Golang, Node.js, Python, or Ruby 프로그래밍 언어 중 1개 이상 사용 가능하신 분... Data Science: Go, Python Collaboration..."
c16d65e660e7e744,"Principal, Data Engineer (Pricing Compet...",Coupang 3.1 서울,,"상을 위한 도구와 가이드 라인의 제공 자격 요건: 컴퓨터 공학 혹은 관련 전공 학위를 소지하신 분 Java, Python 프로그래밍이 가능하신 분 7년 이상 데이터 엔지니어링을 경험하신 분 우대 사항: Back-end..."
10530ea7d98370b7,Data Scientist (Analytics Modeling Exper...,Success Korea 서울,,"systems) a plus ? Experience in programming with JAVA, Python, Perl preferred ? Customer insight, customer segmentation..."
449c79ff66c3925c,Sydney Based Cloud Support Engineer,Success Korea 대한민국,,MySQL/PostgresSQL/MSSQL/Oracle 관련 경험 · Python/Java/Shell/Perl/Ruby/PHP 등 개발/스크립트 언어... Oracle 관련 경험 · Python/Java/Shell/Perl...
2e0415580272fc22,"프로그래머_딥러닝,텐서플로우,웹프로그램,응용프로그램",웹플래너 서울 용산구,"연봉 26,000,000원","업을 대상으로 하는 프로그램을 개발을 하며, 자체 소프트웨어를 개발하는 업무입니다. 필요기술 : php, python, html, jsp, orcle, mySQL, c++, C#, TensorFlow 등 경력조건 무관 필요..."
bfdb6d14b38319a1,소프트웨어 개발 PM,SW개발전문회사 서울 목동,,"대졸 이상 - 웹 개발 경력 등 10년 이상 - 클라우드 서비스와 연계된 서비스를 개발 경험자 - Go, Python, JS(Angular/React) 등을 이용한 웹 애플리케이션 개발 경험자 우대 [전형절차] 서류, 면접..."
b3dc36f873b9e4e3,2020 Market Data Analyst - Seoul (Korean Speaker),Bloomberg 서울,,"languages (e.g. Python, R, JavaScript... programming/scripting languages (e.g. Python, R, JavaScript, Java) as well as SQL..."
c1037225077ca4da,데이터 분석가 (Business Intelligence Analyst),코스닥 상장 중견 게임기업 서울 강남구,"연봉 40,000,000원 - 70,000,000원","데이터 분석 결과를 쉽게 이해할 수 있도록 간결하고 명확한 의사전달 능력 [우대조건] * R, Python, Spark 등의 언어에 대한 이해도 * 모바일 앱SDK 연동 지원 업무 경험(Facebook, Admob..."
b3dc36f873b9e4e3,2020 Market Data Analyst - Seoul (Korean Speaker),Bloomberg 서울,,"languages (e.g. Python, R, JavaScript... programming/scripting languages (e.g. Python, R, JavaScript, Java) as well as SQL..."
9b09565fe78ef392,DX혁신부문 Tech Lab Senior Machine Learning...,이투스교육 서울 강남구,,"분 - 일반적인 백엔드 시스템 설계 및 개발 - ML/AI 시스템 아키텍쳐 설계 경험 - Python, scala, R 등 ML 및 통계 관련 언어 사용 경험 - 머신러닝 프레임워크 경험자 (TensorFlow..."
6ae76a6437a8a2b6,Solution Architecture: Starts-Up/Gaming,Success Korea 서울,,"modern development languages... Ruby, Python and Node.js - Experience working... languages... Ruby, Python and Node..."
2459b164bb22d0f4,DGIST 미래자동차융합연구센터 계약직 연구원 및 박사후연수연구원 공개...,대구경북과학기술원 대구 현풍면,,"사항 - S/W개발능력, C,C++, Python,Matlab 등 능숙자... Software 개발 우대 사항 - S/W개발능력, C,C++, Python, Linux환경 능숙자 - 자율주행 및 ADAS관련 프로젝트 참여경..."
2a1d77bd91952093,(주)엘솔루 개발자,㈜엘솔루 서울,,"필수사항] ㆍ프로그래밍에 재능 및 열정이 있는 자 ㆍJava, Python 중 하나 이상의 언어사용자 ㆍ자료구조 지식이 있는 자 ㆍ학력... 머신러닝(ML)|인터넷·IT·통신·모바일·게임>응용프로그래머> Python"
c16d65e660e7e744,"Principal, Data Engineer (Pricing Compet...",Coupang 3.1 서울,,"상을 위한 도구와 가이드 라인의 제공 자격 요건: 컴퓨터 공학 혹은 관련 전공 학위를 소지하신 분 Java, Python 프로그래밍이 가능하신 분 7년 이상 데이터 엔지니어링을 경험하신 분 우대 사항: Back-end..."
dbe0f6f7da20d201,"Principal, Back-end Engineer (Seller Por...",Coupang 3.1 서울,,Expert with one or more programming language... Java/ Python/Scala Understanding of architectural principles and design...
0775a7b8bbca016c,Senior Server Engineer,레이니스트 서울,,"개발자들에게 코칭 제공 자격 요건 5년 이상 서버 엔지니어링 경험 보유 Golang/Java(Kotlin)/ Python 중 하나 이상에 전문성을 보유, 고도화된 서비스 설계 및 개발 경험 보유 금융관련 IT 업무 경력 보유자..."
74cf47be676133ff,DGIST 미래자동차융합연구센터 계약직 연구원 및 연수연구원 공개 초빙...,대구경북과학기술원 대구 현풍면,,"기술개발 우대 사항 우대사항 - S/W개발능력, C,C++, Python,Matlab 등 능숙자 - 자율주행 및 ADAS관련 프로젝트 참여경... W개발능력, C,C++, Python,Matlab 등 능숙자 - 자율주행..."
838599aa8cfbcf47,Video Solution System Engineer,Success Korea 서울,,"language (e.g. Perl, Ruby, Bash, Python) - Knowledge of video streaming or content... g. Perl, Ruby, Bash, Python) - Knowledge..."
