ID,Title,Location,Salary,Summary
4233609a843b5e96,분석지원팀 - 데이터 분석가,Nexon 성남 분당구,,및 커뮤니케이션 능력 - (필수) 새로운 기술 습득에 능동적이고 거부감이 없는 분 - (선택) R 혹은 Python을 이용한 데이터분석 능력 - (선택) SQL 기본 활용 능력 - (선택) 통계 및 분석에 대한 이론...
d1e75364ef505c68,"데이터 가치 함께 발굴하실 머신러닝, 통계 모델링 전문가",카카오 4.2 성남 판교역,,있으신 분도 환영합니다. 지원자격 개발 경력 만 5년 미만 머신 러닝/통계 등 모델링에 활용하는 언어( Python/Scala/R 등) 및 도구(Tensor flow/Pytorch 등)를 하나 이상 능숙하게 다룰 수 있으...
3b752abecf619fe5,플랫폼 채팅모듈 개발자,Nexon 성남 분당구,,"대사항 - 대규모 동시 접속 및 고용량 데이터 처리 경험 - Unix/Linux 시스템에 대한 이해 - Python, Java, Event-Driven Framework에 대한 이해 - TCP/IP와 네트워크 프로그래밍..."
8e97a01120a4b368,Web Developer,태그바이컴퍼니 서울 강남구,,"507, (삼성동) 8F 기술 스택 Python 업무 소개 • 인플루언서... 모바일>스마트폰 어플리케이션(App)|인터넷·IT·통신·모바일·게임>웹프로그래머> Python|인터넷·IT·통신·모바일·게임>응용프로그래머> Python"
301a562b5b4d2b2e,Data Engineering Manager,레이니스트 서울,,"년 이상 Data Collection, Data Pipeline, Data Warehouse 구축 경험 보유 Python / Java(Scala) 를 이용하여 데이터 분석 툴 개발 가능 스트리밍 또는 배치 Data 기술 (예..."
b7be58e7af38d186,Developer (개발자),Coinplug 경기도 성남,,"Azure 등 Cloud 환경에서 빌드, 배포, 모니터링 등의 경험이 있으신 분 서버 개발 [우대사항] Python / Node.js / Go / Java 중 한 가지 이상의 개발 언어에 익숙하신 분 Restful API..."
dfe05f5ca369a262,"유니챌 SW 개발자 (C/C++, Python, Linux)",유니챌 서울 금천구,,"- 컴퓨터/시스템공학 - 해당직무 근무경험 유니챌주식회사 SW개발 경력 정규직, 프리랜서 채용 모집부문 및 자격요건 모집부문 담당업무 자격요건 인원 SW개발 [담당업무] - 웹 개발 및 응용 소프트웨어 개발 - 근무부서 : 유니..."
3e2a310c9dd0f693,[멜론] 빅데이터 서비스 개발자,카카오 4.2 성남 판교역,,"리즘, OS, 네트워크, SQL의 기초 지식 보유 긍정적이고 원활한 커뮤니케이션 스킬 소유자 우대 사항 Python 지식 보유 기계 학습(또는 딥러닝)에 대한 이해와 경험 데이터 시각화 도구 개발 경험 DevOps 경험..."
498cbbf909edbab6,Global Payment 데이터 분석,LINE Plus corporation 성남 판교역,,"가공/분석 가능 - Data Visualization 능력 - 데이터 분석/모델링을 위한 언어 가능 (R/ Python/Scala 등) - Hadoop M/R, Hive, Spark 등 빅데이터 분석 플랫폼 사용 경험자..."
c6e0b428a62c7eaa,경험최적화파트 - 데이터 사이언티스트/분석가,Nexon 성남 분당구,,피처 탐색 등) - 게임내 행동패턴 로그 분석과 패턴 식별 및 이를 통한 서비스 개선 지원자격 - Python을 사용한 데이터 분석 및 모델 개발 경험 - 머신러닝 라이브러리 활용 경험 - 셀프 모티베이션 - 원활한...
cef60a5a4a42fe95,AD Performance Dev,LINE Plus corporation 성남 서현역,,"Java, Scala 중 2개 이상의 개발 언어에 능숙한 자 - 위 언어중 1개에 익숙하고 R 또는 Python 기반으로 분석에 능숙한 자 아래 요건 중 최소 한 가지 해당 - 대용량 트래픽 서버를 개발 및 운영한..."
a44ca05975d80555,"경력 웹개발자 [PHP,MYSQL]",엠비아이솔루션 서울 마포구,,"프레임워크 기반 개발 경험자 (CI, Cake, Laravel등) [우대사항] - Node.js , Java , Python 등 다양한 환경의 서버개발을 경험한 분 - 리눅스 서버 환경에 대한 이해 - 리눅스 쉘 , 데몬 활용..."
3c1eb33412c9bfb3,데이터분석 경력사원,유비케어 서울 구로구,,AI(인공지능)> Python|인터넷·IT·통신·모바일·게임>빅데이터·AI(인공지능)>하둡(Hadoop)|인터넷·IT·통신·모바일·게임>응용프로그래머>자바스크립트|인터넷·IT·통신·모바일·게임>응용프로그래머> Python|인터넷...
ffac42e32db26233,Lead Product Engineer - Liberate,Cadence Design Systems 경기도,,"problems and propose solution Automation skills using Tcl, Python, Perl and shell scripting Bachelor/Master in EE with 5+..."
a8f2de7c03aa263c,4차산업선도인력 빅데이터-IoT 국비지원 교육생,비트컴퓨터 서울 강남구,,"습득 및 프로젝트 수행 후 관련 분야로 취업을 원하는 자 Java, Python 등 기본 프로그래밍 유 경험자 - 선발 우대사항 IT관련 전공학과... 게임>빅데이터·AI(인공지능)> Python|인터넷·IT·통신·모바일·게임..."
6e4170888fdd92a5,SOFTWARE ENGINEER - BACKEND,"ODK Media, Inc. 서울 강남구",,"Python, Django, REST, Go PostgreSQL, MySQL, Redis AWS, Kubernetes, CDN Qualifications Minimum Available development Python..."
4e17fe419583b40b,데이터 분석 및 모델링 (페이코 쿠폰/광고 타겟팅),NHN 4.4 성남 판교역,,"구축, 피쳐 발굴, 모델 튜닝, 결과 해석 등) - 머신 러닝 및 데이터 분석 관련 언어 (R, Python,SQL 등) 능숙한 활용 - 리눅스 환경에서 개발 가능 - 통계, 머신 러닝 등 관련 분야 (통계..."
6d158e8e6a242927,Linux Specialist,토스 서울 강남구,,개발경험이 있는 분 오픈소스 생태계 변화에 대해 이해하며 높은 레벨의 Linux 시스템 관리 노하우를 보유하신 분 Python 또는 스크립트 언어를 활용하여 코딩을 통한 인프라 운영이 가능한 분 우대 사항 Docker 및...
fc2a932fcb4ac692,2019년 기상청 국가태풍센터 공무직 근로자 (연장),기상청 대한민국,,"소지자 ㅇ 우대조건 - 기상기사, 전산 관련 자격증 소지자 - Python, Fortran 유경험자 국가태풍센터 (제주) 1명 태풍 영향... 전산 관련 자격증 소지자 - Python, Fortran 유경험자 국가..."
af5683389907a8c9,백엔드 개발자 (경력),크로스앵글 서울 반포동,,"데이터 관리 (Auth0) - 블록체인 지갑 인증 (Ethereum, EOS) [자격요건] - 백엔드 & Python 실무 개발경험 3년 이상 혹은 그에 준하는 능력을 갖고 있으신 분 - 새로운 기술에 대해 호기심을 갖고..."
e75ddeeb278d91f2,Principal Business Analysis (CRM),Coupang 3.1 서울,,"sets Experience using a programming language (R, SAS, Python, Java, etc... automation, job scheduling, and statistical..."
f6b4b86e7e3cbf4a,[AI기술] 음성처리기술 개발자,카카오엔터프라이즈 성남 분당구,,통신·모바일·게임>응용프로그래머> Python|인터넷·IT·통신·모바일·게임>웹프로그래머>JAVA|인터넷·IT·통신·모바일·게임>웹프로그래머> Python|인터넷·IT·통신·모바일·게임>빅데이터·AI(인공지능)> Python
e90ef9824373624d,2019년 기상청 국가태풍센터 공무직 근로자,기상청 대한민국,,"소지자 ㅇ 우대조건 - 기상기사, 전산 관련 자격증 소지자 - Python, Fortran 유경험자 국가태풍센터 (제주) 1명 태풍 영향... 전산 관련 자격증 소지자 - Python, Fortran 유경험자 국가..."
a23938a1b6969c37,[Data Lab] 빅데이터 활용 개발 경력사원,네이버 서울,,"지표 분석 또는 집계 경험이 있거나 , 데이터 파이프라인 구축 및 개발 경험 - Java, Scala, Python 등의 최소 1 가지 언어를 활용한 소프트웨어 개발 역량 - 리눅스 환경에서의 시스템 개발 및 운영 경험..."
39d1abf861dbdb6e,[AI Lab] AI 백엔드 엔지니어,버즈니 서울,,"플랫폼 및 시스템 구축 이런 분을 찾습니다 주도적으로 문제를 찾고, 해결할 수 있는 능력을 보유하신 분 Python 사용 경험이 있으신 분 다음 항목 중 두 가지 이상에 해당되는 분 AWS 혹은 GCP와 같은 클라우드 플랫폼..."
ceb8243bc8ae3c35,[홈쇼핑모아] 개발팀 / 데이터 엔지니어,버즈니 서울,,개발 사내 데이터 분석 도구 개발 및 유지보수 이런 분을 찾습니다 관련 업무 경력 최소 3년 이상 있으신 분 Python 및 기반 데이터 플랫폼 개발 경험이 있으신 분 Docker(Contatiner) 기반 시스템 환경 구축...
71375487a518fa4e,[기술플랫폼실] MySQL 담당자 영입,카카오페이 성남 분당구,,"운영 경험 있으신 분 - Python, GO 개발 경험 있으신 분... 응용프로그래머>클라우드|인터넷·IT·통신·모바일·게임>응용프로그래머> Python|인터넷·IT·통신·모바일·게임>빅데이터·AI(인공지능)> Python"
241ae1e7499c461c,Security Engineer (모의해킹/취약점 점검),토스 페이먼츠 서울 강남구,,"우대사항 버그바운트 경험이 있는 분 해킹대회 우승 경력이 있는 분 다양한 플랫폼 보안 진단 경험이 있는 분 Python, C, C++, C#, JAVA 중 프로그래밍 언어에 능숙 하신 분 현업 인터뷰 결제 산업의 미래, 토스..."
b51ca785a45edf17,Senior Specialist Consultant - AI/ML,Amazon Web Services Korea LLC 서울,,"experience in software development in languages like Java, Python, Scala. Experience working with RESTful API and general..."
e40f14640ce2f83b,Senior Data Scientist (Experiment Platfo...,레이니스트 서울,,"이해하고 서비스 구현에 어려움이 없으신 분 데이터 분석/모델링을 위한 언어 및 프레임워크 사용에 익숙하신 분 ( Python, TensorFlow, Keras, PyTorch, Spark 등) 분석 결과를 회사 내부 구성원들과..."
924d1be5b05890da,(Search) 쇼핑검색 AI 기술 개발 신입/경력사원 모집,NAVER 3.9 성남 정자동,,"design / Large-scale data processing 자격요건 및 우대사항 · C, Java, Python, Scala 등 하나 이상의 언어에 능숙 하신 분 · 위 채용분야 관련 2년 이상 실무 경험 또는..."
68875cf86f31569e,ERP 담당자 모집,넷마블 서울 구로구,,"기반 ERP Web Portal 시스템개발/운영 경력 3~9년 보유자 - Spring (혹은 .NET, Python 등) 프로그래밍 가능자 - 시스템 분석/설계 가능자 - 재무/회계 기본 지식 보유자 우대사항 - IT 프로젝..."
cb663654c2b397f3,"Sales Engineer, Sr II",Synopsys 서울,,"Objective-C, and scripting languages... JavaScript, Perl and Python, and CI/CD environment... Jenkins, GitHub, JIRA..."
d0ae3cf7638734ac,데이터 사이언티스트 / Data Scientist,Bagelcode 서울,,규모 데이터 처리 및 분석 [자격 요건] - 직무 관련 경력 2년 이상 (게임 업계 우대) - SQL / Python / R 등 데이터 분석 업무를 수행할 수 있는 하나 이상의 개발 언어 유경험자 - 통계 지식에 대한 이해...
e010f7780d479126,검색서비스 서버 개발 신입/경력,포티투마루 서울 관악구,,"성별 : 무관 - 모집인원 : 0명 [기술 지원자격] - Linux 환경 개발 경력 - C/Java/ Python 개발 경력 - 서버 개발/운영 경력 [우대사항] - 자연어처리, 정보검색, 기계학습, 데이터 마이닝..."
613223ed43a69d4f,DB 엔지니어 모집(DBA),넷마블 서울 구로구,,"및 튜닝 경력 3년 이상 보유자 - OS(Windows, Linux) 에 대한 기본 지식 보유자 - 쉘, Python 스크립트 개발 가능자 - 협업 및 커뮤니케이션이 원활하진 분 우대사항 - 온라인 게임 데이터베이스 운영..."
3a08c7089343733d,광고팀 - 분석가,Nexon 성남 분당구,,및 커뮤니케이션 능력 - (필수) 새로운 기술 습득에 능동적이고 거부감이 없는 분 - (선택) R 혹은 Python을 이용한 데이터분석 능력 - (선택) SQL 기본 활용 능력 - (선택) 통계 및 분석에 대한 이론...
29e3b5646b869f60,[해외취업] 【AI・RPAエンジニア】経験半年の方も歓迎 10ヵ国の技術者が在...,株式会社リープ 대한민국,,"격요건 【必須要件】 ・何かしらのシステム開発経験が半年以上ある方 【歓迎要件】 ・Java, PHP, .NET, Pythonのスキルをお持ちの方 ・顧客折衝や要件定義などの上流工程経験がある方 ・RPAエンジニアとしての実務経験、知識がある方..."
4fa50f2ffd370bae,얼굴모션 캡처기술 인공지능(AI) 연구개발 전문기업,인공지능(AI) 연구개발 전문기업 경기도,,대한 이해 - Tensorflow/Pytorch 등 딥러닝 프레임워크에 대한 깊은 이해와 연구 개발 경험 보유 - Python/C++에 대한 능숙한 개발 경험 7) 우대사항 - 관련 분야 박사학위 소지자 - 인공지능(Deep...
8925ce6bab9d00d6,바디모션 캡처기술 인공지능(AI) 연구개발 전문기업,인공지능(AI) 연구개발 전문기업 경기도,,대한 이해 - Tensorflow/Pytorch 등 딥러닝 프레임워크에 대한 깊은 이해와 연구 개발 경험 보유 - Python/C++에 대한 능숙한 개발 경험 7) 우대사항 - 관련 분야 박사학위 소지자 - 인공지능(Deep...
c99bd2c492c8305f,[긴급]클라우드 기반 MSA향 개발( 대리-차장(서울 ),에이스파트너스서치펌 성남 분당구,,"개발 실무자. ㄱ. 퍼블릭 클라우드(AWS, GCP등)의 다양한 솔루션을 활용하여 서비스 개발 ㄴ. Java, Python 등 프로그래밍 개발 ㄷ. Container 기반 서비스 개발 및 운영 ㄹ. MSA, MVP 방법론 기반..."
1548f8b2dc2157f6,DGIST 동반진단의료기술융합연구실 계약직 연구원 공개 채용 공고,대구경북과학기술원 대구 현풍면,,"경험자 Matlab 또는 Python 활용 능력 우수자 C/C++... 분석 수행 Python을 통한 Data 처리 및 DB 구축 윈도우/리눅스 환경 프로그래밍 가능자(C++, Java, Python 등) 자동..."
e3d0d2bc23f91adb,4차 산업혁명 선도인력양성 교육생,멀티캠퍼스 서울 강남구,,통신·모바일·게임>빅데이터·AI(인공지능)>데이터분석|인터넷·IT·통신·모바일·게임>빅데이터·AI(인공지능)> Python|인터넷·IT·통신·모바일·게임>빅데이터·AI(인공지능)>머신러닝|인터넷·IT·통신·모바일·게임>빅데이터...
8a939aaed9469874,"서버 개발자 (Linux, C,C++, TCP/IP 소켓)",비에이블컨설팅그룹 서울 구로구,,인터넷·IT·통신·모바일·게임>응용프로그래머>인공지능(AI)|인터넷·IT·통신·모바일·게임>응용프로그래머> Python|인터넷·IT·통신·모바일·게임>네트워크·서버·보안>네트워크구축·운영·관리|인터넷·IT·통신·모바일·게임...
977529f65769df3a,[수시] ESTsecurity 웹프론트 개발 채용(경력),이스트시큐리티 서울 서초구,,"개발하시는 분 - Javascript 이외의 개발언어 활용이 가능하신 분 (Typescript, Python, Java 등) - 백앤드 서비스, DB(RDBMS, NoSQL)에 대한 이해와 경험이 있으신분 - Git..."
ea3b136c0ff59524,데이터분석가(게임어뷰징 탐지),Nexon 성남 분당구,,"시스템 운영 등의 빅데이터 활용 업무경력) - 논리적이고 체계적인 문제 해결 및 커뮤니케이션 능력 - Python, Scala 등과 같은 프로그래밍언어로 데이터 분석 및 모델링 능력 (탐색적 데이터분석/ 데이터 전처리..."
bd1ad6ca3aba3000,데이터 엔지니어 / Data Engineer,Bagelcode 서울,,및 개발 [업무 내용] - Python과 Airflow를 이용한 데이터... 이해 - AWS 환경에서 개발/운영 경험 혹은 그에 준하는 지식 - Python / Java / Scala / Kotlin 중 하나 이상을 이용한...
d11342cfe074df78,Frontend Developer (Javascript/React),Bepro Company 서울,"연봉 30,000,000원 - 80,000,000원",참고 - React JS (Web) / Kotlin (Android) / Swift (iOS) - Python + Django - AWS lambda + API gateway - MySQL - Google Cloud...
d11342cfe074df78,Frontend Developer (Javascript/React),Bepro Company 서울,"연봉 30,000,000원 - 80,000,000원",참고 - React JS (Web) / Kotlin (Android) / Swift (iOS) - Python + Django - AWS lambda + API gateway - MySQL - Google Cloud...
c1037225077ca4da,데이터 분석가 (Business Intelligence Analyst),코스닥 상장 중견 게임기업 서울 강남구,"연봉 40,000,000원 - 70,000,000원","데이터 분석 결과를 쉽게 이해할 수 있도록 간결하고 명확한 의사전달 능력 [우대조건] * R, Python, Spark 등의 언어에 대한 이해도 * 모바일 앱SDK 연동 지원 업무 경험(Facebook, Admob..."
ceb8243bc8ae3c35,[홈쇼핑모아] 개발팀 / 데이터 엔지니어,버즈니 서울,,개발 사내 데이터 분석 도구 개발 및 유지보수 이런 분을 찾습니다 관련 업무 경력 최소 3년 이상 있으신 분 Python 및 기반 데이터 플랫폼 개발 경험이 있으신 분 Docker(Contatiner) 기반 시스템 환경 구축...
4233609a843b5e96,분석지원팀 - 데이터 분석가,Nexon 성남 분당구,,및 커뮤니케이션 능력 - (필수) 새로운 기술 습득에 능동적이고 거부감이 없는 분 - (선택) R 혹은 Python을 이용한 데이터분석 능력 - (선택) SQL 기본 활용 능력 - (선택) 통계 및 분석에 대한 이론...
6e4170888fdd92a5,SOFTWARE ENGINEER - BACKEND,"ODK Media, Inc. 서울 강남구",,"Python, Django, REST, Go PostgreSQL, MySQL, Redis AWS, Kubernetes, CDN Qualifications Minimum Available development Python..."
ea3b136c0ff59524,데이터분석가(게임어뷰징 탐지),Nexon 성남 분당구,,"시스템 운영 등의 빅데이터 활용 업무경력) - 논리적이고 체계적인 문제 해결 및 커뮤니케이션 능력 - Python, Scala 등과 같은 프로그래밍언어로 데이터 분석 및 모델링 능력 (탐색적 데이터분석/ 데이터 전처리..."
71e99e78a38b879c,[클라우드플랫폼] 네트워크 엔지니어,카카오엔터프라이즈 성남 분당구,,통신·모바일·게임>웹프로그래머> Python|인터넷·IT·통신·모바일·게임>응용프로그래머> Python|인터넷·IT·통신·모바일·게임>응용프로그래머>클라우드|인터넷·IT·통신·모바일·게임>빅데이터·AI(인공지능)> Python
3e80435be74cd28f,블록체인인터넷경제연구센터 위촉연구원,광주과학기술원 광주 북구,,업무) 지원자격 연구직 O명 블록체인 연구 및 프로그래밍 제작 1) SW프로그래밍 제작 경험자 2) Python/C/Java/Go 프로그래밍 가능자 3) 블록체인 개발 경험자 우대 4) 컴퓨터공학 및 컴퓨터사이...
652a24fac69813b6,[개발팀] 클라우드 및 컨테이너 개발자,심플렉스 서울 동작구,,경험 - 컨테이너 오케스트레이션 시스템(컨테이너와 Kubernetes 등)에 대한 이해 및 경험 - Java/ Python/C/C++/Go/NodeJS/PHP 등 1개 이상의 언어를 능숙하게 사용 가능자 우대요건 - 구축...
0c1f05a0f45f5b4e,동남아 모바일 대출 기획 및 운영,LINE Plus corporation 성남 판교역,,"5년 이상 - 통계, 수학, 산업 공학, 금융 공학 등 데이터 분석 관련 학위 소지자 - SAS, Python, R 프로그램 및 SQL program 경험 - 영어 커뮤니케이션 가능 (verbal and written..."
3c63bba3ee9b3090,"Tech U Associate Solution Architect, Pub...",Amazon Web Services Korea LLC 서울,,"languages: Java, Python, Ruby, Node.js... programming (Node.JS, Java, Ruby, C#, Python, or PHP) · Demonstrated ability..."
bd1ad6ca3aba3000,데이터 엔지니어 / Data Engineer,Bagelcode 서울,,및 개발 [업무 내용] - Python과 Airflow를 이용한 데이터... 이해 - AWS 환경에서 개발/운영 경험 혹은 그에 준하는 지식 - Python / Java / Scala / Kotlin 중 하나 이상을 이용한...
bfe0f5ac4f32ec89,추천 통계분석/데이터사이언티스트,카카오 4.2 성남 판교역,,등 기타 카카오 서비스 영역 전반 지원자격 숙련된 데이터분석 능력 데이터 사이언스를 위한 언어(R/ Python) 를 하나 이상 능숙하게 다룰 수 있으신 분 분석 결과를 설득력있게 전달할 수 있는 분 우대사항 머신...
5d44907c50ac571d,2014년도 국립기상연구소 상반기 연구원(기간제근로자),기상청 대한민국,,운영 및 개선 전산 관련 분야 학사 학위 이상 리눅스 사용 및 쉘 프로그래밍 필수 * 우대조건: Python 경험자 해양연구(F) 0명 전지구 해양순환 예측시스템 개발 해양-대기 상호작용 연구 지역 해양순환...
a22d7b630bff33ea,[수시] ESTsecurity 서버/백엔드 개발 (경력),ESTsecurity 서울 서초구,,"CD에 대한 이해가 있으신 분 - Java 이외의 개발언어 활용이 가능하신 분 (JavaScript, Python, Shell Script 등) - Git, Github, GitLab등의 형상관리 툴을 활용해 보신 분..."
81538d5eb86c2bff,(Clova) 음성 합성 기술 개발 신입/경력사원 모집,NAVER 3.9 성남 정자동,,"보유자 우대 - 최신 딥러닝 및 기계학습 모델링 기법을 활용한 서비스 개발 경험자 우대 - C/C++, Python 등 개발 숙련자 우대 채용하고 싶은 사람 - 여러 사람들과 즐겁게 협업할 수 있는 분 - 특정 방법..."
a23938a1b6969c37,[Data Lab] 빅데이터 활용 개발 경력사원,네이버 서울,,"지표 분석 또는 집계 경험이 있거나 , 데이터 파이프라인 구축 및 개발 경험 - Java, Scala, Python 등의 최소 1 가지 언어를 활용한 소프트웨어 개발 역량 - 리눅스 환경에서의 시스템 개발 및 운영 경험..."
e3d0d2bc23f91adb,4차 산업혁명 선도인력양성 교육생,멀티캠퍼스 서울 강남구,,통신·모바일·게임>빅데이터·AI(인공지능)>데이터분석|인터넷·IT·통신·모바일·게임>빅데이터·AI(인공지능)> Python|인터넷·IT·통신·모바일·게임>빅데이터·AI(인공지능)>머신러닝|인터넷·IT·통신·모바일·게임>빅데이터...
385c58c7ced1d77b,데이터 사이언티스트 지향하는 데이터 엔지니어,카카오 4.2 성남 판교역,,"Spark 등 빅데이터 분석 플랫폼을 사용하여 대용량 데이터의 수집,가공이 가능한 분 프로그램 개발(Java, python 등) 기술을 보유하신 분 어떤 일이라도 중요하게 여기며 책임감 있게 진행할 수 있으신 분 자신의 생각..."
8c8700db243d1a3c,"Application Engineer, Sr II",Synopsys 서울,,"Working knowledge of scripting languages like TCL, Unix Shell, Python, or Perl. Prior AE/design experience is a plus. Working..."
20d40ee61adffeca,챗봇 플랫폼 개발자,카카오 4.2 성남 판교역,,"서비스에 대한 두려움이 없으신 분 서버 개발 Java, Scala, Kotlin 등의 JVM 기반 언어 및 Python을 이용해서 실서비스 개발 및 운영해보신 분 데이터 엔지니어 Kafka, Elasticsearch..."
85687b250386c4be,qe 소프트웨어 엔지니어,에이치알 코리아 대한민국,,"process improvements • Strong scripting experience with Python, Shell Scripts, Ruby, etc. • Ability to code competently..."
3e2a310c9dd0f693,[멜론] 빅데이터 서비스 개발자,카카오 4.2 성남 판교역,,"리즘, OS, 네트워크, SQL의 기초 지식 보유 긍정적이고 원활한 커뮤니케이션 스킬 소유자 우대 사항 Python 지식 보유 기계 학습(또는 딥러닝)에 대한 이해와 경험 데이터 시각화 도구 개발 경험 DevOps 경험..."
8a939aaed9469874,"서버 개발자 (Linux, C,C++, TCP/IP 소켓)",비에이블컨설팅그룹 서울 구로구,,인터넷·IT·통신·모바일·게임>응용프로그래머>인공지능(AI)|인터넷·IT·통신·모바일·게임>응용프로그래머> Python|인터넷·IT·통신·모바일·게임>네트워크·서버·보안>네트워크구축·운영·관리|인터넷·IT·통신·모바일·게임...
3b752abecf619fe5,플랫폼 채팅모듈 개발자,Nexon 성남 분당구,,"대사항 - 대규모 동시 접속 및 고용량 데이터 처리 경험 - Unix/Linux 시스템에 대한 이해 - Python, Java, Event-Driven Framework에 대한 이해 - TCP/IP와 네트워크 프로그래밍..."
1b68c0bd75dbe08d,DGIST 고신뢰CPS연구센터 제1차 계약직 연구원 채용 공고,대구경북과학기술원 대구 현풍면,,"도계, 초음파센서 등의 신호 처리 기술 및 경험 Matlab 중급 이상 사용 능력 프로그램작성 능력 ( Python, C, C++ 등), 워드프로세서, 파워포인트 등 오피스 프로그램 사용 능력 급여수준 : 관련규정에..."
67503f27b0365593,인간중심 지능형 시스템 연구실 시간제 연구원,광주과학기술원 광주 북구,,"우대사항 ① 국가보훈대상자(취업보호대상자) 및 장애인은 관련 법령에 의거하여 우대 ② 이외 개발언어 ( Python, C++, JAVA, MFC, QT 등) 기반 SW(앱/웹 포함) 개발 가능자 ③ 인간대상연구 경험자..."
f5518c7184bf0f10,"AI,BIG DATA개발 경력직",비스퀘어 부산 해운대구,,"- 개발 경력 3년 이상(학원, 교육 이수기간 제외) - 개발 언어 C++, Go, Java, PHP, Python, Nodejs 가능자 - 모바일 개발 언어 Java, Kotlin, Objective-c, Swift 가능자..."
5f3b7800e776da58,Senior Business Analysis (Strategic Plan...,Coupang 3.1 서울,,"e-commerce and other internet-based industries; retail -SQL, Python experience is a plus -Experience with Tableau also a plus..."
deb23c0881100256,FDS 서버 개발,LINE Plus corporation 성남 판교역,,"visualize [자격요건] - 실시간 데이터 처리, pipeline 개발 경험 - java, python 중 하나 이상 언어에 익숙한 자 - Kafka Producer, Consumer 개발 경험 - 시스템 장애..."
952e0a8d9bac4aea,고성능 게임 피드백 서버 개발,Nexon 성남 분당구,,"및 ML 알고리즘을 실행 하는 서버 개발 지원자격 - (필수) 한 가지 이상의 개발 언어(C++, C#, Python 등)에 숙련된 프로그래밍 능력 - RESTful API 및 TCP/UDP 서버 개발 경험 및 네트워크와..."
