ID,Title,Location,Salary,Summary
4233609a843b5e96,분석지원팀 - 데이터 분석가,Nexon 성남 분당구,,및 커뮤니케이션 능력 - (필수) 새로운 기술 습득에 능동적이고 거부감이 없는 분 - (선택) R 혹은 Python을 이용한 데이터분석 능력 - (선택) SQL 기본 활용 능력 - (선택) 통계 및 분석에 대한 이론...
5c97ba86b2dc31f1,음성인식 엔진 개발,현대엠엔소프트 서울 용산구,,경험 보유 [기술 스택] - OS : Linux - 개발언어 : C/C++ 또는 Java [우대 역량] - Python 개발 가능 - 음성인식 개발 경험 보유 - 머신러닝 관련 이해/경험 - HTTP(Restful) API...
f281c810daf0e10d,카카오 네트워크 엔지니어,카카오 4.2 성남 판교역,,"있는 자신감 넘치시는 분 (기술, 응대 모든 면에서) 해외여행 결격사유 없는 분 선호 자격 bash, python 등을 이용한 인프라 관리 자동화 스크립트 가능하신 분 인프라 운영 및 관리 관련 Tool 개발/경험이 있으..."
fc2a932fcb4ac692,2019년 기상청 국가태풍센터 공무직 근로자 (연장),기상청 대한민국,,"소지자 ㅇ 우대조건 - 기상기사, 전산 관련 자격증 소지자 - Python, Fortran 유경험자 국가태풍센터 (제주) 1명 태풍 영향... 전산 관련 자격증 소지자 - Python, Fortran 유경험자 국가..."
3a08c7089343733d,광고팀 - 분석가,Nexon 성남 분당구,,및 커뮤니케이션 능력 - (필수) 새로운 기술 습득에 능동적이고 거부감이 없는 분 - (선택) R 혹은 Python을 이용한 데이터분석 능력 - (선택) SQL 기본 활용 능력 - (선택) 통계 및 분석에 대한 이론...
69b824318cebcbb9,Cross Border e-Commerce - Business Intel...,Shopee 서울,,business analyst related roles Proficient in SQL and Python Strong analytical skill and sensitivity to data Strong oral...
d585814d097935eb,카카오톡 보이스톡/페이스톡/라이브톡 개발자,카카오 4.2 성남 판교역,,"워크 서버 개발 경력 VoIP 기술에 대한 이해 우대 사항 음성 합성 또는 영상 합성 경험 MySQL, Python, JavaScript, Node.js 경험 서비스 운영 경험 ※ 카카오 기술 직군의 경우, 개발 경력 2..."
385c58c7ced1d77b,데이터 사이언티스트 지향하는 데이터 엔지니어,카카오 4.2 성남 판교역,,"Spark 등 빅데이터 분석 플랫폼을 사용하여 대용량 데이터의 수집,가공이 가능한 분 프로그램 개발(Java, python 등) 기술을 보유하신 분 어떤 일이라도 중요하게 여기며 책임감 있게 진행할 수 있으신 분 자신의 생각..."
8af26b37623864c4,8퍼센트 개발자 (신입/경력),8퍼센트 서울 종로구,,개발 금융 데이터 분석과 분석 플랫폼 운영 자격요건 컴퓨터 전공자 또는 웹 개발 경력 1년 이상 우대사항 Python 코드를 무리 없이 읽으실 수 있는 분 Linux/Mac 사용 가능한 분 새로운 기술에 대한 호기심을 가지신...
4cd34228af5013fd,DGIST 2019년 제1차 계약직원 공개채용 공고,대구경북과학기술원 대구 현풍면,,"우수자(SPSS, R 등 통계패키지) 외국어(영어) 구사 능력 우수자 Programming(MATLAB, Python, C/C++ 등) 가능자 · 근무기간 : 2019.3.11.~2020.3.10. ※ 단, 재계약 평가에..."
d71794dc69947981,소프트웨어 엔지니어,Nexon 성남 분당구,,주요업무 - 넥슨 글로벌 플랫폼의 게임 클라이언트 배포 시스템 및 어플리케이션 개발 지원자격 - C++ 혹은 Python 프로그래밍 언어 능숙자 - 비동기 및 병렬처리 프로그래밍 경험 우대사항 - Modern C++ (11...
a8b83b3070bb370a,Tech U Associate Technical Trainer - 202...,Amazon Web Services Korea LLC 서울,,"languages: Java, Python, Ruby, Node.js... programming (Node.JS, Java, Ruby, C#, Python, or PHP) · Demonstrated ability..."
c73ca1effb65d557,AD 데이터 분석,LINE Plus corporation 성남 서현역,,"보유한 자 - Hadoop 환경에 대한 이해를 기반으로 Hive SQL 사용이 능숙한 자 - R, Python 을 모두 사용하여 통계 분석 및 예측 모델링이 가능한 자 - 논리적 추론과 해석, 분석 항목 도출을 통한..."
e7beea26c2f0acc5,기상청 영향예보추진팀 공무직 근로자,기상청 대한민국,,"지구과학 또는 유사분야 - 기상기사, 전산 관련 자격증 소지자 - Python, Fortran, NCL 유경험자 기상청 본청 (서울) 1명... 니한 자 마. 우대조건 ㅇ Python, Fortran, NCL 유경..."
6219c67701d6d524,[해외취업] Senior Back-End Developer,LILI SG 대한민국,"연봉 60,000,000원 - 100,000,000원",있으셔야 합니다. 면접자에게는 구체적으로 어떤 작업들이 더 필요한지 정보를 공유해 드리도록 하겠습니다. Python을 조금 더 선호하지만 프로그래밍 언어는 지원자의 숙련도와 실력에 따라 자율성을 드릴 생각입니다. Front...
b574f1454ae36aab,Cross Border Ecommerce - Business Intell...,Shopee 서울,,business analyst related roles Proficient in SQL and Python Strong analytical skill and sensitivity to data Strong oral...
07375dc4e800dfa9,추천 시스템 소프트웨어 엔지니어,카카오 4.2 성남 판교역,,"트워크, 컴파일러, 데이터베이스에 대한 이해가 깊으신 분 C/C++/ Python 프로그래밍 숙련자 GPU 프로그래밍 숙련자 대용량/실시간 서비스 개발... 키워드 프로그래밍 언어 Python, C/C++, Go, Java..."
7d85150a375cfacf,[Search] BigData and AI Platform S/W엔지니어...,네이버 서울,,터에서 수행되는 다양한 작업에 대한 문제 해결과 성능 향상을 위한 기술 제안 [필수조건] - Java / Python / C / C++ 개발 가능 (경력사원의 경우 1년 이상의 경력) - 리눅스 환경에서의 개발 경험 - 우수...
6e86e9573ba0a69c,"프로그래머 (WEB 프로그래밍, PHP, javascript, pytho...",씨더스 대전 중구,,교육·교사·강사·교직원>IT·문화·직업강사>프로그래밍|인터넷·IT·통신·모바일·게임>웹프로그래머> Python|인터넷·IT·통신·모바일·게임>웹프로그래머>HTML·DHTML·mHTML|인터넷·IT·통신·모바일·게임>웹프로그래머...
41818bc2a8ab8283,WebRTC UC & Collaboration Developer,Ericsson 서울,,"experience: Linux, JavaScript, Node.js, React.js, Docker, Python, WebRTC Media, Low-level Media API, RESTful Understanding..."
b35da47f5e84c9b4,콘텐츠서비스개발팀 - 데이터분석가,Nexon 성남 분당구,,"적인 문제 해결 및 커뮤니케이션 능력 - 새로운 기술 습득에 능동적이고 거부감이 없는 분 우대사항 - Python , Scala 을 이용한 데이터분석 능력 - SQL 기본 활용 능력 - 통계 및 분석에 대한 이론 지식..."
6ed2963730d3c340,Systems Engineer,Hewlett Packard Enterprise 3.8 대전,,"Programming and scripting knowledge and experience (e.g. Perl, Python, C++, etc.) Ability to gather data, perform analysis..."
5875e66f97079bc4,Java developer,국내 코스닥 software업체 서울 서초구,"연봉 39,000,000원 - 54,000,000원","우대조건] ㅇ Java Spring Cloud 개발 경험자 (Netflix Cloud 버전) ㅇ Python Programming 경험자, Netflix OSS 플랫폼을 활용한 시스템 구축 프로젝트 경력자, Swagger..."
20d40ee61adffeca,챗봇 플랫폼 개발자,카카오 4.2 성남 판교역,,"서비스에 대한 두려움이 없으신 분 서버 개발 Java, Scala, Kotlin 등의 JVM 기반 언어 및 Python을 이용해서 실서비스 개발 및 운영해보신 분 데이터 엔지니어 Kafka, Elasticsearch..."
36b2d95ca4db80f4,Machine Learning Researcher - Speech Syn...,Qualcomm 4.1 서울,,"Representation learning of audio/speech signal - Generative models (VAE, GAN, normalizing flow) - Fluency in Python and C/C++"
6c1d50662fa2d7f7,서울 강남구 인썸니아 시니어 개발자 및 퍼블리셔,인썸니아 서울 서초구,,"개발자] 1) 경력: 3~5년차 2) skills: Rails, Python, Django, Node, react 중 한가지 이상 3) 연봉... Django, angular JS, Python 등을 능숙하게 사용하시는..."
8a5c305f2e5018ed,데이터 인프라 담당자 (경력),카카오 4.2 성남 판교역,,"인프라/DB/Hadoop 에 관심이 있으신 분 하둡 기반 대용량 데이터 환경 경험이 있으신 분 Java, python, go, bash 등 스크립팅 언어 중 하나 이상 활용 가능하신 분 데이터 분석가와 협업 경험이 있으신 분..."
56072bc50be2b22b,[R&D] 연료전지시스템 제어 SW 개발,현대자동차그룹 4.4 대한민국,,"적용 SW 설계, SSPL, SW 아키텍처 관련 경험 보유자 - 프로그래밍 언어(Simulink, C/C, Python 등) 실무 적용 가능한 스킬 - SW 아키텍처 도구(UML, SysML 등)의 연구 활용 능력 가능한..."
5bc622575fee61b8,Data Scientist,하이퍼커넥트 서울,,"가이드 자격요건 최소 2년 이상의 데이터 과학 및 분석 실무 경력 능숙한 SQL 구현 역량 및 실무 경험 Python 또는 R 분석 코드 구현 역량 및 실무 경험 머신러닝에 대한 기본 이해 우대사항 개인화, 최적화 등..."
2892c67308e87f01,Field Data Scientist,Success Korea 경기도,,"Scripting experience required (e.g. Matlab, R, Python). Familiarity with analytics... e.g. Matlab, R, Python). Familiarity..."
a358a39da5dfc360,[NAVERxLINE] Global Ad Data Engineer/AI...,네이버 서울,,"Engineering [자격요건 ] - Java, Scala, Python 등의 언어를 활용한 소프트웨어 개발 역량 - 리눅스 환경에서의 시스템 개발... 워크 기반 개발 가능하신 분 - Python, Java, Scala 중 1..."
61ecdc0ef3cfb66a,[경력] 빅데이터 플랫폼 엔지니어,카카오 4.2 성남 판교역,,"미만 <기술> 전산 전공 또는 그에 준하는 실무 경험을 갖추신 분 Java 필수, 그 외 Scala, Python, Ruby 중 1개 이상 언어로 개발 가능하신 분 하둡 플랫폼에 대한 기본 지식을 갖추신 분 하둡 클러스터..."
a41d35173ffe4666,[Search] [Vision] Computer Vision Engine...,네이버 서울,,"스템 엔지니어링 · 스마트렌즈 , 이미지 / 동영상 검색 , 비주얼 커머스 서비스 고도화에 기여 [자격요건] · Python, C++, Golang, Scala 등의 백엔드 개발 언어를 1 개 이상 자유롭게 활용 가능한 분..."
ae15250b0a7f47e0,데이터 엔지니어,크로스앵글 서울 반포동,,"데이터 관리 (Auth0) - 블록체인 지갑 인증 (Ethereum, EOS) [자격요건] - 백엔드 & Python 실무 개발경험 3년 이상 혹은 그에 준하는 능력을 갖고 있으신 분 - 새로운 기술에 대해 호기심을 갖고..."
af4a53fe0b63fce7,"프론트엔드, 백엔드 외 경력개발자 정규직",디노플러스 서울 강남구,"연봉 40,000,000원 - 60,000,000원",Python|인터넷·IT·통신·모바일·게임>웹프로그래머>JSP|인터넷·IT·통신·모바일·게임>웹프로그래머>JAVA|인터넷·IT·통신·모바일·게임>응용프로그래머>API|인터넷·IT·통신·모바일·게임>응용프로그래머> Python...
1701b26651bb739a,(주)넷타겟 Bio-IT 융합 연구소 AI 연구원,넷타겟 대전 유성구,"연봉 60,000,000원 - 90,000,000원","연어 처리 등 - 연구도구 Python 3, Jupyter Notebook... 그래머>인공지능(AI)|인터넷·IT·통신·모바일·게임>응용프로그래머> Python|전자·기계·기술·화학·연구개발>바이오·식품공학>바이오|전자·기계·기술..."
5b8d56d7f11903a2,데이터연동개발팀 - 데이터엔지니어,Nexon 성남 분당구,,구축에 대해 경험이 있으신 분 - SQL 활용 능력이 뛰어나신 분 우대사항 - 경력 3년 이하 - Python이나 Scala 등과 같은 프로그래밍 언어를 활용하여 ETL 개발이 가능하신 분 - Spark를 활용하여...
71375487a518fa4e,[기술플랫폼실] MySQL 담당자 영입,카카오페이 성남 분당구,,"운영 경험 있으신 분 - Python, GO 개발 경험 있으신 분... 응용프로그래머>클라우드|인터넷·IT·통신·모바일·게임>응용프로그래머> Python|인터넷·IT·통신·모바일·게임>빅데이터·AI(인공지능)> Python"
77ff926c2dc1d373,빅데이터분석 신입 및 경력직원,와이즈인컴퍼니 서울 강남구,,"졸업예정자 가능) [우대조건] - 컴퓨터활용능력 우수자 - 산업공학, 전산학,컴퓨터공학, 정보통신공학 - Python, R 사용자 - 데이터 바우처 사업 유경험자(정형/비정형 데이터 가공 및 모델링 0명 근무지역 서울 복리후..."
1cf825d234463890,[피파온라인4] 소프트웨어 엔지니어,Electronic Arts 서울,,관련 논문 및 자료를 이해할 수 있는 영어 능력 keras... tensorflow 사용경험 python을 이용한 코딩 경험 [ 우대 사항 ] Machine Learning 관련 논문을 구현해본 경험 (졸업 작품...
3b752abecf619fe5,플랫폼 채팅모듈 개발자,Nexon 성남 분당구,,"대사항 - 대규모 동시 접속 및 고용량 데이터 처리 경험 - Unix/Linux 시스템에 대한 이해 - Python, Java, Event-Driven Framework에 대한 이해 - TCP/IP와 네트워크 프로그래밍..."
719aaaeffd746a04,FPGA 플랫폼 엔지니어(딥러닝 하드웨어 프로세서 개발),딥엑스 성남 분당구,"연봉 40,000,000원 - 99,990,000원","logic analyzer 사용 경험(Chip Scope/SignalTap) - Language: Python/Perl(<x... c="""" c - Vivado 또는 Synplify 또는 Quartus II 경험 [우대..."
7e259408fd9b4f9c,악성코드 및 엔드포인트 위협 대응 보안 엔지니어 (경력),카카오 4.2 성남 판교역,,"수집/분석 및 테스트 가능하신 분 침해사고대응 가능하신 분 #우대사항 Splunk, ES, EDR 경험자 Python/Linux shell script 중급 이상 가능자 이슈를 적극적으로 발견하고 개선하고자 하는 능동적인..."
abfc94fd3a20ea51,Senior RF/mmW Hardware Lead Engineer,Apple 서울,,"Programming and scripting languages... C, Java, Python, MySQL, or MATLAB Description - Local leader of our on-site..."
d6c05c588971df5a,백엔드 파운트 시스템 엔지니어 (현재 급여수준 이상 보장),파운트 서울 충정로역,,"경험 - Linux명령어 및shell스크립트 작성 능숙 우대사항 - Python, Java등을 이용한 프로그래밍 경험 네트워크및 서버에 대한 표준화... 립트 작성 능숙 우대사항 - Python, Java등을 이용한 프로그래..."
01cdfff2d55c2fa5,PMIC S/W APPS Engineering – Senior to St...,Qualcomm 4.1 서울,,"experience with Programming Language... C, C++, Java, Python , etc Preferred Qualifications 6 to 12 years of academic..."
5c7b686e3fee8fa7,[Ericsson-LG Enterprise] WebRTC UC & Col...,에릭슨엘지 서울 금천구,,웹프로그래머>Servlet|인터넷·IT·통신·모바일·게임>웹프로그래머> Python|인터넷·IT·통신·모바일·게임>웹프로그래머>ASP|인터넷·IT·통신... 통신·모바일·게임>응용프로그래머> Python|인터넷·IT·통신·모바일·게임...
eaee1538d8cc832f,메시지발송 플랫폼 개발자,Nexon 성남 분당구,,"개발 가능하면서 python 개발 경험 소유자(또는 Python 개발 가능... NET 또는 python 개발 경력 5년이상 - 자동화를 위한 스크립트(powershell, bash, python 등) 경험 - Windows..."
464ef95516a5fa5c,8퍼센트 경력 개발자,8퍼센트 서울 종로구,,"개발업무 - 금융 서비스 개발 - Python/Django 기반 - 정해진 역할이 아닌 기능에 따른 업무 분배 - 프로트엔드부터 백엔드까지 업무 범위... SQL 기본 - git flow - python, django 경험자 우대"
f530f7e2ef0269a9,기간제 근로자,기상청 대한민국,,"다음 분야에 대한 학사학위 이상 · 대기과학, 통계학, 지리학, 지구과학 또는 유사분야 - NCL, Python, Fortran 유경험자 기상청 본청 (서울) 1명 2. 근무조건 등 가. 신 분 : 공무원의 사무를..."
d11342cfe074df78,Frontend Developer (Javascript/React),Bepro Company 서울,"연봉 30,000,000원 - 80,000,000원",참고 - React JS (Web) / Kotlin (Android) / Swift (iOS) - Python + Django - AWS lambda + API gateway - MySQL - Google Cloud...
b3dc36f873b9e4e3,2020 Market Data Analyst - Seoul (Korean Speaker),Bloomberg 서울,,"languages (e.g. Python, R, JavaScript... programming/scripting languages (e.g. Python, R, JavaScript, Java) as well as SQL..."
71e99e78a38b879c,[클라우드플랫폼] 네트워크 엔지니어,카카오엔터프라이즈 성남 분당구,,통신·모바일·게임>웹프로그래머> Python|인터넷·IT·통신·모바일·게임>응용프로그래머> Python|인터넷·IT·통신·모바일·게임>응용프로그래머>클라우드|인터넷·IT·통신·모바일·게임>빅데이터·AI(인공지능)> Python
92f303cc42494d43,[솔루션딜리버리] 서버 개발자,카카오엔터프라이즈 성남 분당구,,통신·모바일·게임>응용프로그래머> Python|인터넷·IT·통신·모바일·게임>웹프로그래머>JAVA|인터넷·IT·통신·모바일·게임>웹프로그래머> Python|인터넷·IT·통신·모바일·게임>빅데이터·AI(인공지능)> Python
30e6b7545e75c949,IT 전문가 양성 교육과정 교육생 (취업연계),인제대학교 산학협력단 경상남도 김해,,통신·모바일·게임>웹프로그래머> Python|인터넷·IT·통신·모바일·게임... 데이터분석|인터넷·IT·통신·모바일·게임>빅데이터·AI(인공지능)> Python|인터넷·IT·통신·모바일·게임>빅데이터·AI(인공지능)>머신러닝|인터넷...
b574f1454ae36aab,Cross Border Ecommerce - Business Intell...,Shopee 서울,,business analyst related roles Proficient in SQL and Python Strong analytical skill and sensitivity to data Strong oral...
f3a14b3f8d9e3e12,네이버 쇼핑검색플랫폼 개발자,네이버 서울,,"info extraction [필요역량] - 아래 기술 중 어느 한가지를 능숙하게 다룰 수 있는 분 [ Java, Python, Spring boot/batch/cloud, Kotlin, React, Vue, Node.JS..."
ad1bf1198b168944,"[해외취업] 베리텍, 시스템개발자/응용프로그래머",에임하이글로벌 대한민국,"연봉 32,510,000원 - 65,030,000원","비지니스회화 주요업무내용 1. 개발자 : 시스템개발 업무 수행 및 유지보수 ( JAVA, C#,.Net, Python,PHP) 2. 응용프로그래머 : 솔루션 개발/운영(Web, C#, iOS, Android, Delphi..."
978edf4ea4db4d6c,Senior Full-stack Developer,Asiance 서울,,"React 혹은 WordPress 등의 CMS도 사용. • Python, Node.js, Java, PHP for backend development. • Python, Node.js, Java, PHP 등을 사용하여 백엔드..."
a5405c883e10ded4,APEC 기후센터 직원,기상청 대한민국,,중심의 프로그래밍 개발 경력자 우대) 자료처리 및 분석을 위한 R 및 Python 등 프로그래밍 가능 기초 공간분석 (GIS data analysis... 소지자 통계 분석을 위한 R 및 Python 등 프로그래밍 (필수) 빅데이...
48090bdf1303bd76,매칭팀 - 데이터분석가,Nexon 성남 분당구,,및 대시보드 설계 지원자격 - (필수) 데이터 정제 및 머신러닝 기법 적용에 필요한 프로그래밍 능력 (R or Python) - (필수) SQL 기본 활용 능력 - (선택) Spark를 활용한 데이터 처리 및 분석 능력...
c73ca1effb65d557,AD 데이터 분석,LINE Plus corporation 성남 서현역,,"보유한 자 - Hadoop 환경에 대한 이해를 기반으로 Hive SQL 사용이 능숙한 자 - R, Python 을 모두 사용하여 통계 분석 및 예측 모델링이 가능한 자 - 논리적 추론과 해석, 분석 항목 도출을 통한..."
1c4f1c0b625f5abd,데이터 분석 직군 모집,넷마블 서울 구로구,,"요건 - 관련 분야 경력 3년 이상 - 정형/비정형 데이터 분석 및 모델링 가능 - 통계 분석 도구 (R, Python, Tensorflow 등) 및 SQL 사용 가능 - 다양한 직군의 사람들과 원활한 커뮤니케이션 및 협업..."
aac8e9355cb855ac,[인재풀] 아티스트,Electronic Arts 서울,,Maya or 3D Max등의 아트웍 툴 사용 경험 - Max script 또는 Mel Script의 사용 경험 - C# 또는 Python 언어에 대한 이해 및 활용 능력 - 아트웍 관련 툴 제작 또는 플러그인 제작 경험
6a399a2c059ebbb1,System Engineer (South Korea),Confluent 서울,,Computer Science or relevant experience Proficiency in Java or Python with experience developing ETL applications What gives...
01114810b5f86cb5,[검색플랫폼] 빅데이터 분석 및 AI 개발자,카카오엔터프라이즈 성남 분당구,,"프로그래밍 언어 : JAVA, python, Scala ㄴ 원활한 커뮤니케... 검색의 방향성을 제시 [지원자격] - 기본기술 ㄴ 프로그래밍 언어 : python, Scala ㄴ 원활한 커뮤니케이션, 협업에 어려움이 없으신 분..."
37aebf847064b980,"[정규직]개발자(수집시스템개발, 카피킬러서비스운영)채용",㈜무하유는 대한민국,,"활용 경험 – SSL/IPSEC VPN, DHCP, DNS 서버 구축/운영 경험 – Shell 스크립트, Python을 이용한 인프라 관리 자동화 경험 – 인프라 장비 운영 경험 – 솔루션 구축 및 유지보수 경험 근무조건..."
cd826811aa0f2ab5,기술연구소-연구원,뷰온 서울 금천구,,"AI (DL/ML) 연구 [필수자격요건] - 학력 : 대졸이상, 관련학과 - 경력 : 신입~15년이하 - Python/C#/C++/Tensorflow [우대사항] - 비전 시스템 연구/개발경험 - 영상처리 시스템 개발경험..."
5b8d56d7f11903a2,데이터연동개발팀 - 데이터엔지니어,Nexon 성남 분당구,,구축에 대해 경험이 있으신 분 - SQL 활용 능력이 뛰어나신 분 우대사항 - 경력 3년 이하 - Python이나 Scala 등과 같은 프로그래밍 언어를 활용하여 ETL 개발이 가능하신 분 - Spark를 활용하여...
02dd3cb5f0906404,Data Engineer,레이니스트 서울,,"이상 Data Collection, Data Pipeline, Data Warehouse 구축 경험 보유 Python / Java(Scala) 를 이용하여 데이터 처리 개발 가능 AWS, GCP 중 하나 이상의 클라우드 환경..."
481f953ccaa4bc96,AI 연구/개발 직군 모집,넷마블 서울 구로구,,"ML 관련 분야 경력 6년 이상 - Cloud 서비스 활용 경험 - Python, C/C++, SQL 사용 가능 - Tensorflow 또는 상응하는... 웹 서비스 구축 등 자격요건 - Python 에 능숙하고 C/C++ 혹은..."
71375487a518fa4e,[기술플랫폼실] MySQL 담당자 영입,카카오페이 성남 분당구,,"운영 경험 있으신 분 - Python, GO 개발 경험 있으신 분... 응용프로그래머>클라우드|인터넷·IT·통신·모바일·게임>응용프로그래머> Python|인터넷·IT·통신·모바일·게임>빅데이터·AI(인공지능)> Python"
d6c05c588971df5a,백엔드 파운트 시스템 엔지니어 (현재 급여수준 이상 보장),파운트 서울 충정로역,,"경험 - Linux명령어 및shell스크립트 작성 능숙 우대사항 - Python, Java등을 이용한 프로그래밍 경험 네트워크및 서버에 대한 표준화... 립트 작성 능숙 우대사항 - Python, Java등을 이용한 프로그래..."
d6c27e2108eafb61,Jr. Backend Developer,Delivery Tech Hero 서울,,"어로 코리아는 국내 최대의 Python 개발 조직으로, 나아가 최고의 개발 조직이 되기 위해 노력합니다. Python 으로 server systems... 다져온 우리의 Python 개발 경험은 새로이 Python 세계에 들어오고..."
d71794dc69947981,소프트웨어 엔지니어,Nexon 성남 분당구,,주요업무 - 넥슨 글로벌 플랫폼의 게임 클라이언트 배포 시스템 및 어플리케이션 개발 지원자격 - C++ 혹은 Python 프로그래밍 언어 능숙자 - 비동기 및 병렬처리 프로그래밍 경험 우대사항 - Modern C++ (11...
711b922289384d7f,금융플랫폼 AI 플랫폼 연구개발,금융그룹 AI 플랫폼 연구개발 서울,,격요건 * - 석사학위 이상 보유자 (박사 우대) - 관련 경력 2년 이상 * 필수조건... Python / Scala / Java / JavaScript / TypeScript 중급 이상 (택1) - Data...
b35da47f5e84c9b4,콘텐츠서비스개발팀 - 데이터분석가,Nexon 성남 분당구,,"적인 문제 해결 및 커뮤니케이션 능력 - 새로운 기술 습득에 능동적이고 거부감이 없는 분 우대사항 - Python , Scala 을 이용한 데이터분석 능력 - SQL 기본 활용 능력 - 통계 및 분석에 대한 이론 지식..."
f45c10d21524a45e,Technical Leader - OPC,한국멘토 성남 분당구,,"English. Proficiency in Unix shell scripting, Tcl, Python, and other scripting languages as a plus. Strong analytical..."
6e8017195f641e67,O2O Platform Backend 개발자,에이치에너지 서울 강남구,,"작지만 모든 것을 걸고, 기업가 정신으로 사막을 바꿀 길을 놓습니다. [우대사항] 전공계열: 공학계열 - Python 언어에 능숙하신 분 - 시계열 데이터베이스 사용 경험을 가진 분 - kubernetes 를 이용한 백엔드..."
6f88041c28b6c1ae,한글 Q&A 시스템 연구 개발 신입/경력사원,포티투마루 서울 관악구,,"중(9월예정) [지원자격] - 4년제 대학교 졸업 (전산관련학과 이수 또는 그에 상응하는 교육이수자) - Python, Java, C/C++ 등으로 개발 가능하신 분 - Unix/Linux 시스템에 대한 이해가 있으신 분..."
a0a12bf7366d994f,DBA (RDBMS / NOSQL),LINE Plus corporation 성남 서현역,,"자 - 데이터 모델링에 대한 이해도 - DB기초지식이 견고한 자 - 운영도구등의 개발이 가능한 자 ( Python, Perl, Java 등) - 현실에 안주하지 않고 자기개발에 대한 열정이 넘치는 자 - 해외 출장..."
c6e0b428a62c7eaa,경험최적화파트 - 데이터 사이언티스트/분석가,Nexon 성남 분당구,,피처 탐색 등) - 게임내 행동패턴 로그 분석과 패턴 식별 및 이를 통한 서비스 개선 지원자격 - Python을 사용한 데이터 분석 및 모델 개발 경험 - 머신러닝 라이브러리 활용 경험 - 셀프 모티베이션 - 원활한...
